{
  "api_version": "rvbbit.capability/v1",
  "kind": "managed",
  "name": "clover",
  "title": "Clover",
  "description": "All of Clover in one subscription: 62 semantic SQL operators — 35 calibrated ML specialists (text, structured documents, audio, images, tabular AutoML, anomaly detection, imputation, forecasting with business drivers, time-series similarity, clustering, and SHAP explanations), 22 LLM operators for fuzzy judgment and structured extraction, safe web extraction, plus cited research with tenant-scoped evidence memory, deep gap closure, and change watches. ML and extraction operators are unmetered on every tier; lanes buy LLM generation speed.",
  "tags": [
    "managed",
    "clover",
    "bundle",
    "specialists",
    "llm",
    "web",
    "documents",
    "lanes",
    "verified"
  ],
  "operators": [
    {
      "name": "clover_means",
      "description": "TRUE if text semantically matches a criterion (cross-encoder)"
    },
    {
      "name": "clover_relevance",
      "description": "Relevance score 0..1 of text to criterion"
    },
    {
      "name": "clover_similar",
      "description": "Embedding cosine similarity of two texts"
    },
    {
      "name": "clover_embed",
      "description": "Reusable Arctic text embedding vector for KNN, similarity and clustering"
    },
    {
      "name": "clover_entails",
      "description": "TRUE if premise entails hypothesis (NLI)"
    },
    {
      "name": "clover_contradicts",
      "description": "TRUE if two statements contradict (NLI 3-class)"
    },
    {
      "name": "clover_sentiment",
      "description": "Sentiment label + score for a text"
    },
    {
      "name": "clover_sentiment_score",
      "description": "Continuous sentiment in [-1, 1]"
    },
    {
      "name": "clover_classify",
      "description": "Zero-shot classification over your labels"
    },
    {
      "name": "clover_classify_scores",
      "description": "Zero-shot classification with the winning label and every candidate score"
    },
    {
      "name": "clover_nli",
      "description": "Full 3-way entailment, neutral, and contradiction scores"
    },
    {
      "name": "clover_toxic",
      "description": "TRUE if text is toxic"
    },
    {
      "name": "clover_moderate",
      "description": "Full moderation category scores"
    },
    {
      "name": "clover_language",
      "description": "ISO language code of text"
    },
    {
      "name": "clover_language_info",
      "description": "Language code plus confidence for thresholded routing"
    },
    {
      "name": "clover_extract",
      "description": "Entity extraction (GLiNER) over your types"
    },
    {
      "name": "clover_pii",
      "description": "PII detection preset (person, email, phone, ssn, ...)"
    },
    {
      "name": "clover_ocr",
      "description": "OCR a document to plain text through the structured Granite-Docling parser"
    },
    {
      "name": "clover_document_parse",
      "description": "Parse a document into Markdown, typed blocks, tables, cells, hierarchy and source geometry"
    },
    {
      "name": "clover_transcribe",
      "description": "Transcribe audio to text (Whisper large-v3-turbo)"
    },
    {
      "name": "clover_forecast",
      "description": "Forecast a numeric series N steps ahead — median + quantile bands"
    },
    {
      "name": "clover_forecast_drivers",
      "description": "Forecast named related series with historical and known-future business drivers"
    },
    {
      "name": "clover_series_anomalies",
      "description": "Score a long time series for anomalies with CPU-side TSPulse"
    },
    {
      "name": "clover_series_impute",
      "description": "Fill missing points in a time series with TSPulse reconstruction"
    },
    {
      "name": "clover_series_embed",
      "description": "Create a semantic TSPulse embedding for the most recent 512 points"
    },
    {
      "name": "clover_series_similarity",
      "description": "Compare two time-series shapes with TSPulse semantic similarity"
    },
    {
      "name": "clover_image_similar",
      "description": "Similarity of two images, or an image and a text description"
    },
    {
      "name": "clover_image_embed",
      "description": "Reusable SigLIP2 embedding for an image or text description"
    },
    {
      "name": "clover_cluster",
      "description": "Cluster a JSON array of texts into assignments and representative groups"
    },
    {
      "name": "clover_fit",
      "description": "Fit a TabPFN model on tabular rows — the fitted model is returned to you"
    },
    {
      "name": "clover_predict",
      "description": "Predict with a clover_fit model — classifications or regressions"
    },
    {
      "name": "clover_explain",
      "description": "SHAP feature attributions for a fitted TabPFN or anomaly model"
    },
    {
      "name": "clover_anomaly_fit",
      "description": "Fit an anomaly detector on numeric rows (client-held model)"
    },
    {
      "name": "clover_anomaly_score",
      "description": "Score rows for anomalousness against a fitted detector"
    },
    {
      "name": "clover_relations",
      "description": "Extract (subject, predicate, object) relation triples from text"
    },
    {
      "name": "clover_llm_ask",
      "description": "One-shot ask against the hosted generalist"
    },
    {
      "name": "clover_llm_apply",
      "description": "Apply an instruction/question to a text — answers only from the text"
    },
    {
      "name": "clover_llm_extract",
      "description": "Freeform text to a JSON object per a schema you describe"
    },
    {
      "name": "clover_llm_translate",
      "description": "Translate to any language — returns only the translation"
    },
    {
      "name": "clover_llm_anonymize",
      "description": "Rewrite text with all PII redacted ([NAME], [EMAIL], ...)"
    },
    {
      "name": "clover_llm_canonical",
      "description": "Canonical form of a value (NYC -> New York City)"
    },
    {
      "name": "clover_llm_fix",
      "description": "Repair malformed values given a type hint (gmial.com -> gmail.com)"
    },
    {
      "name": "clover_llm_date",
      "description": "Messy text to ISO 8601 date, or NULL"
    },
    {
      "name": "clover_llm_means",
      "description": "TRUE if text semantically matches a criterion — LLM-judged for inputs that need thought"
    },
    {
      "name": "clover_llm_implies",
      "description": "TRUE if premise implies conclusion — incl. the quantifier logic fast NLI misses"
    },
    {
      "name": "clover_llm_contradicts",
      "description": "TRUE if two texts oppose each other on the same subject"
    },
    {
      "name": "clover_llm_score",
      "description": "Judge text against any English-phrased criterion, 0-1"
    },
    {
      "name": "clover_llm_supports",
      "description": "How strongly evidence supports a claim, 0-1"
    },
    {
      "name": "clover_llm_valid",
      "description": "TRUE if a value satisfies an English-phrased rule"
    },
    {
      "name": "clover_llm_steelman",
      "description": "Rewrite an argument in its strongest, most defensible form"
    },
    {
      "name": "clover_llm_fallacies",
      "description": "Detect logical fallacies — JSON array of {fallacy, explanation}"
    },
    {
      "name": "clover_llm_same_entity",
      "description": "TRUE if two values identify the same real-world entity"
    },
    {
      "name": "clover_llm_merge_records",
      "description": "Merge duplicate JSON records into one canonical golden record"
    },
    {
      "name": "clover_llm_timeline",
      "description": "Extract a normalized chronological event timeline from text"
    },
    {
      "name": "clover_llm_consensus",
      "description": "Synthesize the shared consensus across a JSON array of findings"
    },
    {
      "name": "clover_llm_make_operator",
      "description": "The operator operator: describe an operator in plain English → drafts it, creates it under a temp name, runs generated tests, self-corrects, then promotes it with its tests attached"
    },
    {
      "name": "clover_triples",
      "description": "Extract knowledge-graph triples from text as strict JSON — same contract as the built-in rvbbit.triples, so every KG surface (data_crawl, Document Brain, Scry) can run on it"
    },
    {
      "name": "clover_web_scrape",
      "description": "Fetch a public HTTP(S) page or document and return Markdown, metadata, provenance, and extraction diagnostics"
    },
    {
      "name": "clover_web_markdown",
      "description": "Fetch a public HTTP(S) page or document and return its cleaned Markdown"
    },
    {
      "name": "clover_web_research",
      "description": "Research the public web with cited claims, typed knowledge, tenant-scoped snapshots, and exact evidence lineage"
    },
    {
      "name": "clover_web_research_deep",
      "description": "Research with one bounded follow-the-evidence pass to close material gaps"
    },
    {
      "name": "clover_web_watch",
      "description": "Refresh stable public URLs, reuse unchanged evidence without another synthesis, and report source and claim changes"
    }
  ],
  "managed": {
    "vendor": "rvbbit.ai",
    "status": "available",
    "entitlement": "clover",
    "key_env": "RVBBIT_CLOVER_KEY",
    "pricing": {
      "monthly_usd": 299,
      "from": true,
      "note": "a lane = one LLM generation in flight — ML operators are unmetered on every tier",
      "tiers": [
        {
          "name": "Free",
          "lanes": 1,
          "monthly_usd": 0,
          "checkout_url": "https://rvbbit.ai/buy/clover-free"
        },
        {
          "name": "Pro",
          "lanes": 5,
          "monthly_usd": 299,
          "checkout_url": "https://rvbbit.ai/buy/clover-pro"
        },
        {
          "name": "Scale",
          "lanes": 25,
          "monthly_usd": 999,